Document ID,Chapter,Section No.,Section,Sub-Section,Summary,Action Item,Due date,Periodicity,Marked as Completed,Work Status,Role Assigned To,Document Summary,Document Action Item
IT_Outsourcing_20250527183423_4a84b4a4-11a8-4180-9ce5-44eaab66b708,Preliminary,1,Short title and Commencement,"- (a) These Directions shall be called the Reserve Bank of India (Outsourcing of Information Technology Services) Directions, 2023. - (b) These Directions shall come into effect from October 1, 2023. - I. With respect to existing outsourcing arrangements that are already in force as on the date of issuance of this Master Direction, REs shall ensure that: - i. the agreements that are due for renewal before October 1, 2023 shall comply with the provisions of these Directions as on the renewal date (preferably), but not later than 12 months from the date of issuance of this Master Direction. - ii. the agreements that are due for renewal on or after October 1, 2023 shall comply with the provisions of these Directions as on the renewal date or 36 months from the date of issuance of this Master Direction whichever is earlier. - II. With respect to new outsourcing arrangements, REs shall ensure that: - i. the agreements that come into force before October 1, 2023, shall comply with the provisions of these Directions as on the agreement date (preferably) but not later than 12 months from the date of issuance of this Master Direction. - ii. the agreements that come into force on or after October 1, 2023, shall comply with the provisions of these Directions from the date of agreement itself.","The Reserve Bank of India (Outsourcing of Information Technology Services) Directions, 2023 mandates compliance for existing and new outsourcing arrangements by specified dates relative to October 1, 2023.",Ensure all existing outsourcing agreements are updated to comply with the new Directions by the applicable deadlines.,2024-10-01,N/A,No,Not Started,,"**  
The document consists of the Reserve Bank of India's (RBI) Master Direction on Outsourcing of Information Technology Services issued in April 2023, effective from October 1, 2023. Its primary goal is to establish a comprehensive regulatory framework governing the outsourcing of IT services by regulated entities (REs), encompassing commercial banks, co-operative banks, non-banking financial companies, and other financial institutions. 

The document underscores the need for REs to adopt strong governance measures to mitigate risks associated with outsourcing, ensuring that such arrangements do not hamper their ability to meet customer obligations or impede RBI's supervisory functions. Key requirements highlighted in the guidelines include the board's responsibility in the approval of outsourcing policies, the establishment of robust risk management frameworks, and mandates for continuous monitoring and evaluation of outsourced services. 

The document elaborates on various elements such as the necessity for a comprehensive IT outsourcing policy, thorough due diligence when engaging service providers, and the importance of having legally binding agreements that define the responsibilities of all parties involved. Furthermore, it emphasizes maintaining data confidentiality, ensuring business continuity and disaster recovery, and developing effective grievance redressal mechanisms for customers. Specific guidelines for monitoring arrangements, creating inventories of outsourced services, and addressing issues related to cross-border outsourcing are detailed to provide clarity and compliance assurance. 

The concluding sections stress the need for a well-defined exit strategy for outsourcing agreements to ensure smooth transitions in case of termination, including data handling protocols. 

**","**  
- Develop and implement a comprehensive IT outsourcing policy approved by the Board that outlines the roles and responsibilities of senior management, IT functions, and risk management protocols.
- Conduct a thorough risk assessment of the need for outsourcing IT services and implement necessary controls.
- Ensure all outsourcing agreements are legally binding and clearly define the rights and obligations of both REs and service providers.
- Establish a robust grievance redressal mechanism to address customer complaints related to outsourced services.
- Implement a monitoring framework to evaluate the performance and compliance of outsourced IT activities consistently.
- Create an inventory of all outsourced services and regularly update it to reflect current dependencies and risks.
- Prepare a detailed exit strategy for all outsourcing agreements, ensuring compliance on data handling and transition processes."
IT_Outsourcing_20250527183423_4a84b4a4-11a8-4180-9ce5-44eaab66b708,Preliminary,2,Applicability,"- (a) These Directions shall be applicable to the following entities, collectively referred to as ‘regulated entities’ or ’REs’ in these directions: - (i) all Banking Companies, Corresponding New Banks and State Bank of India as defined under subsections (c), (da) and (nc) of section 5 of the Banking Regulation Act, 1949 (collectively referred to as ‘commercial banks’ hereinafter). - (ii) Primary Co-operative Banks as defined under clause (ccv) of subsection 1 of section 56 of the Banking Regulation Act, 1949 and included in ‘Tier 3’ and ‘Tier 4’ as defined in paragraphs 1.c and 1.d respectively of the Annex to RBI circular DOR.REG.No.84/07.01.000/2022-23 dated December 01, 2022 on ‘Revised Regulatory Framework - Categorization of Urban Co-operative Banks (UCBs) for Regulatory Purposes’ (hereinafter referred to as ‘Urban Co-operative Banks’ or ‘UCBs’). - (iii) Non-Banking Financial Companies as defined under clause (f) of section 45I of the Reserve Bank of India Act, 1934 and included in ‘Top Layer’, ‘Upper Layer’ and ‘Middle Layer’ as defined in paragraphs 1.5, 1.4 and 1.3 respectively of the Annex to RBI circular DOR.CRE.REC.No.60/03.10.001/2021-22 dated October 22, 2021 on ‘Scale Based Regulation (SBR): A Revised Regulatory Framework for NBFCs’ (hereinafter referred to as ‘NBFCs’). - (iv) Credit Information Companies as defined under clause (e) of section 2 of the Credit Information Companies (Regulation) Act, 2005 (hereinafter referred to as ‘Credit Information Companies’ or ‘CICs’). - (v) EXIM Bank, National Bank for Agriculture and Rural Development (‘NABARD’), National Bank for Financing Infrastructure and Development (‘NaBFID’), National Housing Bank (‘NHB’) and Small Industries Development Bank of India (‘SIDBI’) as established by the Export-Import Bank of India Act, 1981; the National Bank for Agriculture and Rural Development Act, 1981; the National Bank For Financing Infrastructure and Development Act, 2021; National Housing Bank Act, 1987 and the Small Industries Development Bank of India Act, 1989, respectively (hereinafter referred to as ‘All India Financial Institutions or ‘AIFIs’). - (b) In the case of foreign banks operating in India through branch mode, reference to the Board or Board of Directors in these Directions should be read as reference to the Head Office or controlling office which has the oversight over the branch operations in India. Further, such foreign banks shall be subject to a ‘comply or explain’ approach wherein such foreign banks may deviate from any specific part of these Directions subject to examination and acceptance by the RBI of a reasonably justifiable explanation for the same. - (c) These Directions shall apply to Material Outsourcing of Information Technology (‘IT’) Services arrangements (as defined in clause 3(a)(ii) below) entered by the REs.","The Directions delineate the applicability to various entities including banking companies, cooperative banks, non-banking financial companies, credit information companies, and all-India financial institutions, while outlining a 'comply or explain' approach for foreign banks operating in India.","Identify and classify the entity type (banking, cooperative, NBFC, CIC, or AIFI) to ensure compliance with relevant IT services arrangements provisions.",N/A,N/A,No,Not Started,,,
IT_Outsourcing_20250527183423_4a84b4a4-11a8-4180-9ce5-44eaab66b708,Preliminary,3,Definitions,"- a) In these Directions, unless the context states otherwise, the terms herein shall bear the meanings assigned to them below: - (i) ""Group” shall be as defined in the ‘Guidelines on Management of Intra-Group Transactions and Exposures’ issued vide circular DBOD.No. BP.BC.96/21.06.102/2013-14 dated February 11, 2014, as amended from time to time. - (ii) “Material Outsourcing of IT Services” are those which: - a) if disrupted or compromised shall have the potential to significantly impact the RE’s business operations; or - b) may have material impact on the RE’s customers in the event of any unauthorized access, loss or theft of customer information. - (iii) “Outsourcing” shall be as defined in RBI ‘Guidelines on Managing Risks and Code of Conduct in Outsourcing of Financial Services by banks’ issued vide circular DBOD.NO.BP.40/21.04.158/2006-07 dated November 3, 2006, as amended from time to time. - (iv) “Outsourcing of IT Services” shall include outsourcing of the following activities: - a) IT infrastructure management, maintenance and support (hardware, software or firmware); - b) Network and security solutions, maintenance (hardware, software or firmware); - c) Application Development, Maintenance and Testing; Application Service Providers (ASPs) including ATM Switch ASPs; - d) Services and operations related to Data Centres; - e) Cloud Computing Services; - f) Managed Security Services; and - g) Management of IT infrastructure and technology services associated with payment system ecosystem. - (v) “Service Provider” means the provider of IT or IT enabled services including entities related to the RE or those which belong to the same group or conglomerate to which the RE belongs. Appendix III provides an indicative (but not exhaustive) list of a) Services/ Activities not considered under “Outsourcing of IT Services” for the purpose of this Master Direction and b) Vendors/ Entities who are not considered as Third-Party Service Provider (TPSP) for the purpose of this Master Direction. - b) All expressions unless defined herein shall have the same meaning as have been assigned to them under the Banking Regulation Act, 1949 or the Reserve Bank of India Act, 1934 or Credit Information Companies (Regulation) Act, 2005 or Information Technology Act, 2000 or Companies Act, 2013 and Rules made thereunder or any statutory modification or re-enactment thereto or as used in RBI Directions / Circulars, as the case may be.","This section defines key terms related to outsourcing and IT services, including ""Group,"" ""Material Outsourcing of IT Services,"" ""Outsourcing,"" and ""Service Provider,"" along with references to applicable regulatory guidelines.",Review and integrate the defined terms and conditions related to outsourcing of IT services into organizational policies and procedures.,N/A,N/A,No,Not Started,,,
IT_Outsourcing_20250527183423_4a84b4a4-11a8-4180-9ce5-44eaab66b708,Role of the Regulated Entity,4,Regulatory and Supervisory requirements,"- (a) Outsourcing of any activity shall not diminish RE’s obligations as also of its Board and Senior Management, who shall be ultimately responsible for the outsourced activity. RE shall take steps to ensure that the service provider employs the same high standard of care in performing the services as would have been employed by the RE, if the same activity was not outsourced. REs shall not engage an IT service provider that would result in reputation of RE being compromised or weakened. - (b) Notwithstanding whether the service provider is located in India or abroad, the REs shall ensure that the outsourcing should neither impede nor interfere with the ability of the RE to effectively oversee and manage its activities. Further, the RE shall ensure that the outsourcing does not impede the RBI in carrying out its supervisory functions and objectives. - (c) REs shall ensure that the service provider, if not a group company, shall not be owned or controlled by any director, or key managerial personnel, or approver of the outsourcing arrangement of the RE, or their relatives. The terms ‘control’, ‘director’, ‘key managerial personnel’, and ‘relative’ have the same meaning as assigned under the Companies Act, 2013 and the Rules framed thereunder from time to time. However, an exception to this requirement may be made with the approval of Board/ Board level Committee, followed by appropriate disclosure, oversight and monitoring of such arrangements. The Board shall inter-alia ensure that there is no conflict of interest arising out of third-party engagements. - (d) Additional requirements pertaining to usage of cloud computing services and outsourcing of Security Operations Center (SOC) services are outlined in Appendix I and Appendix II, respectively.","Regulated Entities (REs) must ensure that outsourcing does not diminish their responsibilities, does not impede supervision or conflict of interest, and must comply with additional outlined requirements for cloud services and SOC outsourcing.","Review and ensure all outsourcing agreements adhere to the outlined obligations and restrictions, including potential conflicts of interest.",N/A,N/A,No,Not Started,,,
IT_Outsourcing_20250527183423_4a84b4a4-11a8-4180-9ce5-44eaab66b708,Role of the Regulated Entity,5,Comprehensive assessment of need for outsourcing and attendant risks,"- REs shall evaluate the need for Outsourcing of IT Services based on comprehensive assessment of attendant benefits, risks and availability of commensurate processes to manage those risks. REs shall inter-alia consider: - (a) determining the need for outsourcing based on criticality of activity to be outsourced; - (b) determining expectations and outcome from outsourcing; - (c) determining success factors and cost-benefit analysis; and - (d) deciding the model for outsourcing.","Regulated Entities must conduct a comprehensive assessment to evaluate the need for outsourcing IT services, considering factors such as criticality, expectations, success factors, and cost-benefit analysis.",Perform a thorough assessment of outsourcing needs for IT services based on specified criteria.,N/A,N/A,No,Not Started,,,
IT_Outsourcing_20250527183423_4a84b4a4-11a8-4180-9ce5-44eaab66b708,Role of the Regulated Entity,6,Compliance with all applicable statutory and regulatory requirements,"- The RE shall consider all relevant laws, regulations, rules, guidelines and conditions of approval, licensing or registration, when performing its due diligence in relation to outsourcing of IT services.",The Regulated Entity must consider all relevant laws and regulations when conducting due diligence for outsourcing IT services.,Conduct a thorough review of applicable laws and regulations related to IT outsourcing by establishing compliance protocols.,N/A,N/A,No,Not Started,,,
IT_Outsourcing_20250527183423_4a84b4a4-11a8-4180-9ce5-44eaab66b708,Role of the Regulated Entity,7,Grievance Redressal Mechanism,"- (a) REs shall have a robust grievance redressal mechanism that shall not be compromised in any manner on account of outsourcing, i.e., responsibility for redressal of customers’ grievances related to outsourced services shall rest with the RE. - (b) Outsourcing arrangements shall not affect the rights of a customer against the RE, including the ability of the customer to obtain redressal as applicable under relevant laws.",Regulated Entities must maintain a robust grievance redressal mechanism without outsourcing responsibility and ensure customer rights are upheld in outsourced arrangements.,Establish and document a grievance redressal framework that ensures compliance with customer rights and responsibilities.,N/A,N/A,No,Not Started,,,
IT_Outsourcing_20250527183423_4a84b4a4-11a8-4180-9ce5-44eaab66b708,Role of the Regulated Entity,8,Inventory of Outsourced Services,"- REs shall create an inventory of services provided by the service providers (including key entities involved in their supply chains). Further, REs shall map their dependency on third parties and periodically evaluate the information received from the service providers.","Regulated entities must create and maintain an inventory of outsourced services, assess dependencies on third parties, and periodically evaluate provider information.",Develop and document an inventory of outsourced services and establish a process for ongoing evaluations of third-party information.,N/A,periodic evaluations,No,Not Started,,,
IT_Outsourcing_20250527183423_4a84b4a4-11a8-4180-9ce5-44eaab66b708,Governance Framework,9,IT Outsourcing Policy,"- An RE intending to outsource any of its IT activities shall put in place a comprehensive Board approved IT outsourcing policy. The policy shall incorporate, inter alia, the roles and responsibilities of the Board, Committees of the Board (if any) and Senior Management, IT function, business function as well as oversight and assurance functions in respect of outsourcing of IT services. It shall further cover the criteria for selection of such activities as well as service providers, parameters for defining material outsourcing based on the broad criteria, delegation of authority depending on risk and materiality, disaster recovery and business continuity plans, systems to monitor and review the operations of these activities and termination processes and exit strategies, including business continuity in the event of a third-party service provider exiting the outsourcing arrangement.","Organizations must develop a comprehensive, Board-approved IT outsourcing policy detailing roles, responsibilities, selection criteria, monitoring systems, and exit strategies for outsourcing.",Draft and obtain Board approval for the IT outsourcing policy encompassing all required components.,N/A,N/A,No,Not Started,,,
IT_Outsourcing_20250527183423_4a84b4a4-11a8-4180-9ce5-44eaab66b708,Governance Framework,10,Role of the Board,"- The Board of the RE shall be responsible, inter alia, for: - (a) putting in place a framework for approval of IT outsourcing activities depending on risks and materiality; - (b) approving policies to evaluate the risks and materiality of all existing and prospective IT outsourcing arrangements; and - (c) setting up suitable administrative framework of Senior Management for the purpose of these Directions.",The Board of the RE is tasked with establishing an approval framework for IT outsourcing activities and approving relevant risk evaluation policies.,Develop and implement an IT outsourcing approval framework and risk evaluation policies by Q4 2025.,2025-12-31,one-time,No,Not Started,,,
IT_Outsourcing_20250527183423_4a84b4a4-11a8-4180-9ce5-44eaab66b708,Governance Framework,11,Role of the Senior Management,"- The Senior Management of the RE shall, inter alia, be responsible for: - (a) formulating IT outsourcing policies and procedures, evaluating the risks and materiality of all existing and prospective IT outsourcing arrangements based on the framework commensurate with the complexity, nature and scope, in line with the enterprise-wide risk management of the organisation approved by the Board and its implementation; - (b) prior evaluation of prospective IT outsourcing arrangements and periodic evaluation of the existing outsourcing arrangements covering the performance review, criticality and associated risks of all such arrangements based on the policy approved by the Board; - (c) identifying IT outsourcing risks as they arise, monitoring, mitigating, managing and reporting of such risks to the Board/ Board Committee in a timely manner; - (d) ensuring that suitable business continuity plans based on realistic and probable disruptive scenarios, including exit of any third-party service provider, are in place and tested periodically; - (e) ensuring (i) effective oversight over third-party for data confidentiality and (ii) appropriate redressal of customer grievances in a timely manner; - (f) ensuring an independent review and audit on a periodic basis for compliance with the legislations, regulations, Board-approved policy and performance standards and reporting the same to Board/ Board Committee; and - (g) creating essential capacity with required skillsets within the organisation for proper oversight of outsourced activities.","Senior Management must develop and evaluate IT outsourcing policies, assess risks, ensure business continuity plans, oversee third-party data confidentiality, conduct independent reviews, and build necessary organizational capacity.",Formulate and implement IT outsourcing policies and procedures that align with board-approved enterprise risk management.,N/A,ongoing,No,Not Started,,,
IT_Outsourcing_20250527183423_4a84b4a4-11a8-4180-9ce5-44eaab66b708,Governance Framework,12,Role of IT Function,"- The responsibilities of the IT Function of the RE shall, inter alia, include: - (a) assisting the Senior Management in identifying, measuring, monitoring, mitigating and managing the level of IT outsourcing risk in the organisation; - (b) ensuring that a central database of all IT outsourcing arrangements is maintained and is accessible for review by Board, Senior Management, Auditors and Supervisors; - (c) effectively monitor and supervise the outsourced activity to ensure that the service providers meet the laid down performance standards and provide uninterrupted services, report to the Senior Management; co-ordinate periodic due diligence and highlight concerns, if any; and - (d) putting in place necessary documentation required for contractual agreements including service level management, monitoring of vendor operations, key risk indicators and classifying the vendors as per the determined risk.","The IT Function is responsible for managing IT outsourcing risks, maintaining accessibility of outsourcing databases, monitoring service provider performance, conducting due diligence, and ensuring necessary contractual documentation is in place.",Develop and implement a central database for IT outsourcing arrangements and establish monitoring protocols for service providers.,N/A,ongoing,No,Not Started,,,
IT_Outsourcing_20250527183423_4a84b4a4-11a8-4180-9ce5-44eaab66b708,Evaluation and Engagement of Service Providers,13,Due Diligence on Service Providers,"- (a) In considering or renewing an Outsourcing of IT Services arrangement, appropriate due diligence shall be performed to assess the capability of the service provider to comply with obligations in the outsourcing agreement on an ongoing basis. - (b) A risk-based approach shall be adopted in conducting such due diligence activities. - (c) Due diligence shall take into consideration qualitative, quantitative, financial, operational, legal and reputational factors. Where possible, the RE shall obtain independent reviews and market feedback on the service provider to supplement its own assessment. - (d) REs shall also consider, while evaluating the capability of the service provider, risks arising from concentration of outsourcing arrangements with a single or a few service providers.","Organizations must conduct ongoing due diligence on service providers when outsourcing IT services, employing a risk-based approach that evaluates various qualitative and quantitative factors.","Implement a due diligence process that assesses service providers' capabilities, incorporating independent reviews and market feedback.",N/A,ongoing,No,Not Started,,,
