Document_ID,Chapter,Section,Sub Section,Description,Compliance_Requirements,Due date,Applicability,Role Assigned To,Summary,Action Item
IT_Outsourcing,I - Usage of Cloud Computing Services,Cloud Computing Services,"1. While considering adoption of cloud solution, it is imperative to analyse the business strategy and goals adopted to the current IT applications footprint and associated costs. Cloud adoption ranges from moving only non-business critical workloads to the cloud to moving critical business applications such as SaaS adoption and the several combinations in-between, which should be based on a business technology risk assessment.","1. While considering adoption of cloud solution, it is imperative to analyse the business strategy and goals adopted to the current IT applications footprint and associated costs. Cloud adoption ranges from moving only non-business critical workloads to the cloud to moving critical business applications such as SaaS adoption and the several combinations in-between, which should be based on a business technology risk assessment.",Compliance required,N/A,Regulated Entities,Compliance Team,Evaluate business strategy and associated costs when considering cloud adoption for IT applications and conduct a technology risk assessment.,Conduct a business technology risk assessment to determine appropriate cloud solution options.
IT_Outsourcing,I - Usage of Cloud Computing Services,Cloud Computing Services,"2. In engaging cloud services, REs shall ensure, inter alia, that the Outsourcing of IT Services policy addresses the entire lifecycle of data, i.e., covering the entire span of time from generation of the data, its entry into the cloud, till the data is permanently erased/deleted. The REs shall ensure that the procedures specified are consistent with business needs and legal and regulatory requirements.","2. In engaging cloud services, REs shall ensure, inter alia, that the Outsourcing of IT Services policy addresses the entire lifecycle of data, i.e., covering the entire span of time from generation of the data, its entry into the cloud, till the data is permanently erased/deleted. The REs shall ensure that the procedures specified are consistent with business needs and legal and regulatory requirements.",Compliance required,N/A,Regulated Entities,Compliance Team,"REs must ensure their Outsourcing of IT Services policy addresses data lifecycle management, from generation to permanent deletion, in compliance with business and regulatory standards.",Review and update the Outsourcing of IT Services policy to encompass the full data lifecycle.
IT_Outsourcing,I - Usage of Cloud Computing Services,Cloud Computing Services,"3. In adoption of cloud services, REs shall take into account the cloud service specific factors, viz., multi-tenancy, multi-location storing/processing of data, etc., and attendant risks, while establishing appropriate risk management framework. Cloud security is a shared responsibility between the RE and the Cloud Service Provider.","3. In adoption of cloud services, REs shall take into account the cloud service specific factors, viz., multi-tenancy, multi-location storing/processing of data, etc., and attendant risks, while establishing appropriate risk management framework. Cloud security is a shared responsibility between the RE and the Cloud Service Provider.",Compliance required,2024-03-31,Regulated Entities,Compliance Team,Regulatory entities must consider specific cloud service factors and risks when developing a risk management framework for cloud services.,Review and update the risk management framework to include cloud service factors by next quarter.
IT_Outsourcing,I - Usage of Cloud Computing Services,Cloud Computing Services,"4. Cloud Governance: REs shall adopt and demonstrate a well-established and documented cloud adoption policy. Such a policy should, inter alia, identify the activities that can be moved to the cloud, enable and support protection of various stakeholder interests, ensure compliance with regulatory requirements, including those on privacy, security, data sovereignty, recoverability and data storage requirements, aligned with data classification. The policy should provide for appropriate due diligence to manage and continually monitor the risks associated with CSPs.","4. Cloud Governance: REs shall adopt and demonstrate a well-established and documented cloud adoption policy. Such a policy should, inter alia, identify the activities that can be moved to the cloud, enable and support protection of various stakeholder interests, ensure compliance with regulatory requirements, including those on privacy, security, data sovereignty, recoverability and data storage requirements, aligned with data classification. The policy should provide for appropriate due diligence to manage and continually monitor the risks associated with CSPs.",Compliance required,N/A,Regulated Entities,Compliance Team,REs must establish a documented cloud adoption policy that ensures compliance with regulatory requirements and manages risks associated with cloud service providers.,Draft and implement the cloud adoption policy by following the outlined requirements.
IT_Outsourcing,I - Usage of Cloud Computing Services,Cloud Computing Services,"5. Cloud Service Providers (CSP) Considerations for selection of CSP: REs shall ensure that the selection of the CSP is based on a comprehensive risk assessment of the CSP. REs shall enter into a contract only with CSPs subject to jurisdictions that uphold enforceability of agreements and the rights available thereunder to REs, including those relating to aspects such as data storage, data protection and confidentiality.","5. Cloud Service Providers (CSP) Considerations for selection of CSP: REs shall ensure that the selection of the CSP is based on a comprehensive risk assessment of the CSP. REs shall enter into a contract only with CSPs subject to jurisdictions that uphold enforceability of agreements and the rights available thereunder to REs, including those relating to aspects such as data storage, data protection and confidentiality.",Compliance required,N/A,Regulated Entities,Compliance Team,REs must select CSPs based on comprehensive risk assessments and ensure contracts are enforceable under suitable jurisdictions.,Conduct risk assessments for potential CSPs and establish enforceable contracts by evaluating jurisdiction laws.
IT_Outsourcing,I - Usage of Cloud Computing Services,Cloud Computing Services,"b) Identity and Access Management (IAM): IAM shall be agreed upon with the CSP and ensured for providing role-based access to the cloud hosted applications, in respect of user-access and privileged-access. Stringent access controls, as applicable for an on-premise application, may be established for identity and access management to cloud-based applications. Segregation of duties and role conflict matrix should be implemented for all kinds of user-access and privileged-access roles in the cloud-hosted application irrespective of the cloud service model. Access provisioning should be governed by principles of ‘need to know’ and ‘least privileges’. In addition, multi-factor authentication should be implemented for access to cloud applications.","b) Identity and Access Management (IAM): IAM shall be agreed upon with the CSP and ensured for providing role-based access to the cloud hosted applications, in respect of user-access and privileged-access. Stringent access controls, as applicable for an on-premise application, may be established for identity and access management to cloud-based applications. Segregation of duties and role conflict matrix should be implemented for all kinds of user-access and privileged-access roles in the cloud-hosted application irrespective of the cloud service model. Access provisioning should be governed by principles of ‘need to know’ and ‘least privileges’. In addition, multi-factor authentication should be implemented for access to cloud applications.",Compliance required,N/A,Regulated Entities,Compliance Team,Organizations must establish IAM practices with role-based access controls and multi-factor authentication for cloud applications.,Implement a role conflict matrix and multi-factor authentication for all cloud-hosted applications.
IT_Outsourcing,I - Usage of Cloud Computing Services,Cloud Computing Services,"c) Security Controls: REs shall ensure that the implementation of security controls in the cloud-based application achieves similar or higher degree of control objectives than those achieved in/by an on-premise application. This includes ensuring - secure connection through appropriate deployment of network security resources and their configurations; appropriate and secure configurations, monitoring of the cloud assets utilised by the RE; necessary procedures to authorise changes to cloud applications and related resources.","c) Security Controls: REs shall ensure that the implementation of security controls in the cloud-based application achieves similar or higher degree of control objectives than those achieved in/by an on-premise application. This includes ensuring - secure connection through appropriate deployment of network security resources and their configurations; appropriate and secure configurations, monitoring of the cloud assets utilised by the RE; necessary procedures to authorise changes to cloud applications and related resources.",Compliance required,N/A,Regulated Entities,Compliance Team,"REs must implement security controls in cloud applications that meet or exceed those of on-premise applications, including secure connections and change authorization procedures.",Ensure all cloud applications implement the required security controls and configurations by conducting a comprehensive audit.
IT_Outsourcing,I - Usage of Cloud Computing Services,Cloud Computing Services,"d) Robust Monitoring and Surveillance: REs shall accurately define minimum monitoring requirements in the cloud environment. REs should ensure to assess the information/cyber security capability of the cloud service provider, such that, the i) CSP maintains an information security policy framework commensurate with its exposures to vulnerabilities and threats; ii) CSP is able to maintain its information/cyber security capability with respect to changes in vulnerabilities and threats, including those resulting from changes to information assets or its business environment; iii) nature and frequency of testing of controls by the CSP in respect of the outsourced services is commensurate with the materiality of the services being outsourced by the RE and the threat environment; and iv) CSP has mechanisms in place to assess the sub-contractors with regards to confidentiality, integrity and availability of the data being shared with the sub-contractors, where applicable.","d) Robust Monitoring and Surveillance: REs shall accurately define minimum monitoring requirements in the cloud environment. REs should ensure to assess the information/cyber security capability of the cloud service provider, such that, the i) CSP maintains an information security policy framework commensurate with its exposures to vulnerabilities and threats; ii) CSP is able to maintain its information/cyber security capability with respect to changes in vulnerabilities and threats, including those resulting from changes to information assets or its business environment; iii) nature and frequency of testing of controls by the CSP in respect of the outsourced services is commensurate with the materiality of the services being outsourced by the RE and the threat environment; and iv) CSP has mechanisms in place to assess the sub-contractors with regards to confidentiality, integrity and availability of the data being shared with the sub-contractors, where applicable.",Compliance required,N/A,Regulated Entities,Compliance Team,REs must define monitoring requirements and evaluate their cloud service providers' cybersecurity capabilities to mitigate risks effectively.,Conduct an assessment of the cloud service provider’s security policies and testing mechanisms by the next quarterly review.
IT_Outsourcing,I - Usage of Cloud Computing Services,Cloud Computing Services,"e) Appropriate integration of logs, events from the CSP into the RE’s SOC, wherever applicable and/or retention of relevant logs in cloud shall be ensured for incident reporting and handling of incidents relating to services deployed on the cloud.","e) Appropriate integration of logs, events from the CSP into the RE’s SOC, wherever applicable and/or retention of relevant logs in cloud shall be ensured for incident reporting and handling of incidents relating to services deployed on the cloud.",Compliance required,N/A,Regulated Entities,Compliance Team,Ensure integration of CSP logs into the RE's SOC for effective incident reporting and handling.,Implement log integration and establish retention protocols for relevant cloud logs.
IT_Outsourcing,I - Usage of Cloud Computing Services,Cloud Computing Services,"f) The RE’s own efforts in securing its application shall be complemented by the CSP’s cyber resilience controls. The CSP/RE shall ensure continuous and regular updates of security-related software including upgrades, fixes, patches and service packs for protecting the application from advanced threats/malware.","f) The RE’s own efforts in securing its application shall be complemented by the CSP’s cyber resilience controls. The CSP/RE shall ensure continuous and regular updates of security-related software including upgrades, fixes, patches and service packs for protecting the application from advanced threats/malware.",Compliance required,N/A,Regulated Entities,Compliance Team,The RE and CSP must regularly update security software to protect against advanced threats.,"Establish a schedule for continuous updates of security-related software, including patches and upgrades."
IT_Outsourcing,I - Usage of Cloud Computing Services,Cloud Computing Services,g) Vulnerability Management: REs shall ensure that CSPs have a well-governed and structured approach to manage threats and vulnerabilities supported by requisite industry-specific threat intelligence capabilities.,g) Vulnerability Management: REs shall ensure that CSPs have a well-governed and structured approach to manage threats and vulnerabilities supported by requisite industry-specific threat intelligence capabilities.,Compliance required,2024-06-30,Regulated Entities,Compliance Team,REs must ensure CSPs have a structured approach for managing threats and vulnerabilities using relevant threat intelligence.,Establish a governance framework for vulnerability management with threat intelligence capabilities by Q2 2024.
IT_Outsourcing,I - Usage of Cloud Computing Services,Cloud Computing Services,"b) REs shall ensure that the CSP puts in place demonstrative capabilities for preparedness and readiness for cyber resilience as regards cloud services in use by them. This should be systematically ensured, inter alia, through robust incident response and recovery practices including conduct of Disaster Recovery (DR) drills at various levels of cloud services including necessary stakeholders.","b) REs shall ensure that the CSP puts in place demonstrative capabilities for preparedness and readiness for cyber resilience as regards cloud services in use by them. This should be systematically ensured, inter alia, through robust incident response and recovery practices including conduct of Disaster Recovery (DR) drills at various levels of cloud services including necessary stakeholders.",Compliance required,N/A,Regulated Entities,Compliance Team,REs are required to ensure that their CSP establishes robust cyber resilience through incident response practices and Disaster Recovery drills.,Coordinate with the CSP to implement and schedule regular Disaster Recovery drills.
IT_Outsourcing,I - Usage of Cloud Computing Services,Cloud Computing Services,b) monitoring the ongoing design of applications and service delivery technology stack that the exit plans should align with.,b) monitoring the ongoing design of applications and service delivery technology stack that the exit plans should align with.,Compliance required,2024-03-31,Regulated Entities,Compliance Team,Organizations should ensure exit plans are compatible with the design of applications and technology used in service delivery.,Review and update exit plans to align with the current technology stack by Q1 2024.
