Document ID,Chapter,Section No.,Section,Sub-Section,Summary,Action Item,Due date,Periodicity,Marked as Completed,Work Status,Role Assigned To,Document Summary,Document Action Item
IT_Outsourcing_20250527183423_4a84b4a4-11a8-4180-9ce5-44eaab66b708,Evaluation and Engagement of Service Providers,14,Aspects to be considered,"- Due diligence shall involve evaluation of all available information, as applicable, about the service provider, including but not limited to: - (a) past experience and demonstrated competence to implement and support the proposed IT activity over the contract period; - (b) financial soundness and ability to service commitments even under adverse conditions; - (c) business reputation and culture, compliance, complaints and outstanding or potential litigations; - (d) conflict of interest, if any; - (e) external factors like political, economic, social and legal environment of the jurisdiction in which the service provider operates and other events that may impact data security and service performance; - (f) details of the technology, infrastructure stability, security and internal control, audit coverage, reporting and monitoring procedures, data backup arrangements, business continuity management and disaster recovery plan; - (g) capability to identify and segregate REs data; - (h) quality of due diligence exercised by the service provider with respect to its employees and sub-contractors; - (i) capability to comply with the regulatory and legal requirements of the Outsourcing of IT Services arrangement; - (j) information/cyber security risk assessment; - (k) ensuring that appropriate controls, assurance requirements and possible contractual arrangements are in place to ensure data protection and RE's access to the data which is processed, managed or stored by the service provider; - (l) ability to effectively service all the customers while maintaining confidentiality, especially where a service provider has exposure to multiple entities; and - (m) ability to enforce agreements and the rights available thereunder including those relating to aspects such as data storage, data protection and confidentiality.","Organizations must conduct comprehensive due diligence on service providers, evaluating their qualifications, financial stability, compliance record, and operational capabilities to ensure effective risk management and data protection.",Implement a due diligence process that assesses all specified criteria for evaluating service providers.,N/A,N/A,No,Not Started,,,
IT_Outsourcing_20250527183423_4a84b4a4-11a8-4180-9ce5-44eaab66b708,Outsourcing Agreement,15,Legally binding agreement,"- (a) REs shall ensure that their rights and obligations and those of each of their service providers are clearly defined and set out in a legally binding written agreement. - (b) In principle, the provisions of the agreement should appropriately reckon the criticality of the outsourced task to the business of the RE, the associated risks and the strategies for mitigating or managing them. - (c) The terms and conditions governing the contract shall be carefully defined and vetted by the RE’s legal counsel for their legal effect and enforceability. The agreement shall be sufficiently flexible to allow the RE to retain adequate control over the outsourced activity and the right to intervene with appropriate measures to meet legal and regulatory obligations. - (d) The agreement shall also bring out the nature of legal relationship between the parties.","REs must establish clearly defined and legally binding agreements with service providers that account for the criticality of outsourced tasks and associated risks, and ensure that the terms are vetted by legal counsel.",Draft and review legally binding agreements with service providers by involving legal counsel to ensure compliance with outlined provisions.,N/A,N/A,No,Not Started,,,
IT_Outsourcing_20250527183423_4a84b4a4-11a8-4180-9ce5-44eaab66b708,Outsourcing Agreement,16,Aspects to be considered in agreement,"- The agreement at a minimum should include (as applicable to the scope of Outsourcing of IT Services) the following aspects: - (a) details of the activity being outsourced, including appropriate service and performance standards including for the sub-contractors, if any; - (b) effective access by the RE to all data, books, records, information, logs, alerts and business premises relevant to the outsourced activity, available with the service provider; - (c) regular monitoring and assessment of the service provider by the RE for continuous management of the risks holistically, so that any necessary corrective measures can be taken immediately; - (d) type of material adverse events (e.g., data breaches, denial of service, service unavailability, etc.) and the incidents required to be reported to RE to enable RE to take prompt risk mitigation measures and ensure compliance with statutory and regulatory guidelines; - (e) compliance with the provisions of Information Technology Act, 2000, other applicable legal requirements and standards to protect the customer data; - (f) the deliverables, including Service-Level Agreements (SLAs) formalizing performance criteria to measure the quality and quantity of service levels; - (g) storage of data (as applicable to the concerned REs) only in India as per extant regulatory requirements; - (h) clauses requiring the service provider to provide details of data (related to RE and its customers) captured, processed and stored; - (i) controls for maintaining confidentiality of data of RE’s and its customers, and incorporating service provider’s liability to RE in the event of security breach and leakage of such information; - (j) types of data/information that the service provider (vendor) is permitted to share with RE’s customer and/or any other party; - (k) specifying the resolution process, events of default, indemnities, remedies, and recourse available to the respective parties; - (l) contingency plan(s) to ensure business continuity and testing requirements; - (m) right to conduct audit of the service provider (including its sub-contractors) by the RE, whether by its internal or external auditors, or by agents appointed to act on its behalf, and to obtain copies of any audit or review reports and findings made about the service provider in conjunction with the services performed for the RE; - (n) right to seek information from the service provider about the third parties (in the supply chain) engaged by the former; - (o) recognising the authority of regulators to perform inspection of the service provider and any of its sub-contractors. Adding clauses to allow RBI or person(s) authorised by it to access the RE's IT infrastructure, applications, data, documents, and other necessary information given to, stored or processed by the service provider and/or its sub-contractors in relation and as applicable to the scope of the outsourcing arrangement; - (p) including clauses making the service provider contractually liable for the performance and risk management practices of its sub-contractors; - (q) obligation of the service provider to comply with directions issued by the RBI in relation to the activities outsourced to the service provider, through specific contractual terms and conditions specified by the RE; - (r) clauses requiring prior approval/consent of the RE for use of sub-contractors by the service provider for all or part of an outsourced activity; - (s) termination rights of the RE, including the ability to orderly transfer the proposed IT-outsourcing arrangement to another service provider, if necessary or desirable; - (t) obligation of the service provider to co-operate with the relevant authorities in case of insolvency/resolution of the RE; - (u) provision to consider skilled resources of service provider who provide core services as “essential personnel” so that a limited number of staff with back-up arrangements necessary to operate critical functions can work on-site during exigencies (including pandemic situations); - (v) clause requiring suitable back-to-back arrangements between service providers and the OEMs; and - (w) clause requiring non-disclosure agreement with respect to information retained by the service provider.","The outsourcing agreement must include detailed provisions covering various aspects such as service descriptions, data access, performance monitoring, compliance with legal standards, and risks management for IT services.",Review and incorporate all required aspects into the outsourcing agreement with service provider.,N/A,one-time,No,Not Started,,,
IT_Outsourcing_20250527183423_4a84b4a4-11a8-4180-9ce5-44eaab66b708,Risk Management,17,Risk Management Framework,"- (a) REs shall put in place a Risk Management framework for Outsourcing of IT Services that shall comprehensively deal with the processes and responsibilities for identification, measurement, mitigation, management, and reporting of risks associated with Outsourcing of IT Services arrangements. - (b) The risk assessments carried out by the REs shall be suitably documented with necessary approvals in line with the roles and responsibilities for the Board of Directors, Senior Management and IT Function. Such risk assessments shall be subject to internal and external quality assurance on a periodic basis as determined by the Board-approved policy. - (c) REs shall be responsible for the confidentiality and integrity of data and information pertaining to the customers that is available to the service provider. - (d) Access to data at RE’s location/data centre by service providers shall be on need-to-know basis, with appropriate controls to prevent security breaches and/or data misuse. - (e) Public confidence and customer trust in REs is a prerequisite for their stability and reputation. Hence, REs shall seek to ensure the preservation and protection of the security and confidentiality of customer information in the custody or possession of the service provider. Access to customer information by staff of the service provider shall be on need-to-know basis. - (f) In the event of multiple service provider relationships where two or more service providers collaborate to deliver an end-to-end solution, the RE remains responsible for understanding and monitoring the control environment of all service providers that have access to the RE’s data, systems, records or resources. - (g) In instances where service provider acts as an outsourcing agent for multiple REs, care shall be taken to build adequate safeguards so that there is no combining of information, documents, records and assets. - (h) The RE shall ensure that cyber incidents are reported to the RE by the service provider without undue delay, so that the incident is reported by the RE to the RBI within 6 hours of detection by the TPSP. - (i) The REs shall review and monitor the control processes and security practices of the service provider to disclose security breaches. The REs shall immediately notify RBI in the event of breach of security and leakage of confidential customer related information. In these eventualities, REs shall adhere to the extant instructions issued by RBI from time to time on Incident Response and Recovery Management. - (j) Concentration Risk: REs shall effectively assess the impact of concentration risk posed by multiple outsourcings to the same service provider and/or the concentration risk posed by outsourcing critical or material functions to a limited number of service providers.","REs must establish a comprehensive Risk Management framework for Outsourcing IT Services, ensuring proper risk assessment, data integrity, and specific protocols for security and customer information confidentiality.",Develop and implement a Risk Management framework for Outsourcing IT Services and conduct documented risk assessments with board approvals.,N/A,N/A,No,Not Started,,,
IT_Outsourcing_20250527183423_4a84b4a4-11a8-4180-9ce5-44eaab66b708,Risk Management,18,Business Continuity Plan and Disaster Recovery Plan,"- (a) REs shall require their service providers to develop and establish a robust framework for documenting, maintaining and testing Business Continuity Plan (BCP) and Disaster Recovery Plan (DRP) commensurate with the nature and scope of the outsourced activity as per extant instructions issued by RBI from time to time on BCP/DR requirements. - (b) In establishing a viable contingency plan, REs shall consider the availability of alternative service providers or the possibility of bringing the outsourced activity back in-house in an emergency, and the costs, time and resources that would be involved. - (c) In order to mitigate the risk of unexpected termination of the outsourcing agreement or insolvency/liquidation of the service provider, REs shall retain an appropriate level of control over their IT-outsourcing arrangement along with right to intervene, with appropriate measures to continue its business operations. - (d) REs shall ensure that service providers are able to isolate the REs’ information, documents and records and other assets. This is to ensure that, in adverse conditions or termination of the contract, all documents, record of transactions and information with the service provider and assets of the RE can be removed from the possession of the service provider, or deleted, destroyed or rendered unusable.","REs must ensure service providers develop and maintain robust Business Continuity and Disaster Recovery Plans, consider alternative providers, control outsourcing arrangements, and facilitate the isolation of REs' sensitive information.",Require service providers to establish and document BCP and DRP frameworks and ensure information isolation protocols are in place.,N/A,ongoing,No,Not Started,,,
IT_Outsourcing_20250527183423_4a84b4a4-11a8-4180-9ce5-44eaab66b708,Monitoring and Control of Outsourced Activities,19,Monitoring and Control of Outsourced Activities,"- (a) REs shall have in place a management structure to monitor and control its Outsourced IT activities. This shall include (as applicable to the scope of Outsourcing of IT Services) but not limited to monitoring the performance, uptime of the systems and resources, service availability, adherence to SLA requirements, incident response mechanism, etc. - (b) RE shall conduct regular audits (as applicable to the scope of Outsourcing of IT Services) of service providers (including sub-contractors) with regard to the activity outsourced by it. Such audits may be conducted either by RE’s internal auditors or external auditors appointed to act on RE’s behalf. - (c) While outsourcing various IT services, more than one RE may be availing services from the same third-party service provider. In such scenarios, in lieu of conducting separate audits by individual REs of the common service provider, they may adopt pooled (shared) audit. This allows the relevant REs to either pool their audit resources or engage an independent third-party auditor to jointly audit a common service provider. However, in doing so, it shall be the responsibility of REs in ensuring that the audit requirements related to their respective contract with the service provider are met effectively. - (d) The audits shall assess the performance of the service provider, adequacy of the risk management practices adopted by the service provider, compliance with laws and regulations, etc. The frequency of the audit shall be determined based on the nature and extent of risk and impact to the RE from the outsourcing arrangements. Reports on the monitoring and control activities shall be reviewed periodically by the Senior Management and in case of any adverse development, the same shall be put up to the Board for information. - (e) REs, depending upon the risk assessment, may also rely upon globally recognised third-party certifications made available by the service provider in lieu of conducting independent audits. However, this shall not absolve REs of their responsibility in ensuring assurance on the controls and procedures required to safeguard data security (including availability of systems) at the service provider’s end. - (f) The RE shall periodically review the financial and operational condition of the service provider to assess its ability to continue to meet its Outsourcing of IT Services obligations. RE shall adopt risk-based approach in defining the periodicity. Such due diligence reviews shall highlight any deterioration or breach in performance standards, confidentiality, and security, and in operational resilience preparedness. - (g) In the event of termination of the outsourcing agreement for any reason in cases where the service provider deals with the customers of the RE, the same shall be given due publicity by the RE so as to ensure that the customers stop dealing with the concerned service provider. - (h) REs shall ensure that the service provider grants unrestricted and effective access to a) data related to the outsourced activities; b) the relevant business premises of the service provider; subject to appropriate security protocols, for the purpose of effective oversight use by the REs, their auditors, regulators and other relevant Competent Authorities, as authorised under law.","REs must establish a management structure for overseeing outsourced IT activities, conduct regular audits of service providers, and ensure access to data and premises while periodically reviewing the service provider's financial and operational condition.",Implement a management structure for monitoring outsourced IT services and schedule regular audits of service providers.,N/A,ongoing,No,Not Started,,,
IT_Outsourcing_20250527183423_4a84b4a4-11a8-4180-9ce5-44eaab66b708,Outsourcing within a Group / Conglomerate,20,Outsourcing within a Group / Conglomerate,"- (a) A RE may outsource any IT activity/IT enabled service within its business group/conglomerate, provided that such an arrangement is backed by the Board-approved policy and appropriate service level arrangements/agreements with its group entities are in place. - (b) The selection of a group entity shall be based on objective reasons that are similar to selection of a third-party, and any conflicts of interest that such an outsourcing arrangement may entail shall be appropriately dealt with. - (c) REs, at all times, shall maintain an arm's length relationship in dealings with their group entities. Risk management practices being adopted by the RE while outsourcing to a group entity shall be identical to those specified for a non-related party.","A RE may outsource IT activities to group entities under a Board-approved policy, ensuring objective selection criteria and maintenance of an arm's length relationship while adhering to identical risk management practices.",Develop and implement a Board-approved policy for outsourcing IT activities to group entities by ensuring proper service level agreements are in place.,N/A,ongoing,No,Not Started,,,
IT_Outsourcing_20250527183423_4a84b4a4-11a8-4180-9ce5-44eaab66b708,Cross- Border Outsourcing,21,Additional requirements for Cross-Border Outsourcing,"- (a) The engagement of a service provider based in a different jurisdiction exposes the RE to country risk. To manage such risk, the RE shall closely monitor government policies of the jurisdiction in which the service provider is based and the political, social, economic and legal conditions on a continuous basis, as well as establish sound procedures for mitigating the country risk. This includes, inter alia, having appropriate contingency and exit strategies. Further, it shall be ensured that availability of records to the RE and the RBI will not be affected even in case of liquidation of the service provider. - (b) The governing law of the arrangement shall also be clearly specified. In principle, arrangements shall only be entered into with parties operating in jurisdictions upholding confidentiality clauses and agreements. - (c) The right of the RE and the RBI to direct and conduct audit or inspection of the service provider based in a foreign jurisdiction shall be ensured. - (d) The arrangement shall comply with all statutory requirements as well as regulations issued by the RBI from time to time.","Regulatory entities must continuously monitor the country risk associated with foreign service providers, ensure records availability, define governing law, uphold confidentiality, guarantee audit rights, and comply with statutory and RBI regulations.",Establish monitoring procedures for service provider jurisdictions and develop contingency strategies.,N/A,ongoing,No,Not Started,,,
IT_Outsourcing_20250527183423_4a84b4a4-11a8-4180-9ce5-44eaab66b708,Exit Strategy,22,Exit Strategy,"- (a) The Outsourcing of IT Services policy shall contain a clear exit strategy with regard to outsourced IT activities/IT enabled services, while ensuring business continuity during and after exit. The strategy should include exit strategy for different scenarios of exit or termination of services with stipulation of minimum period to execute such plans, as necessary. In documenting an exit strategy, the RE shall, inter alia, identify alternative arrangements, which may include performing the activity by a different service provider or RE itself. - (b) REs shall ensure that the agreement has necessary clauses on safe removal/destruction of data, hardware and all records (digital and physical), as applicable. However, service provider shall be legally obliged to cooperate fully with both the RE and new service provider(s) to ensure there is a smooth transition. Further, agreement shall ensure that the service provider is prohibited from erasing, purging, revoking, altering or changing any data during the transition period, unless specifically advised by the regulator/concerned RE.",Organizations must develop an exit strategy for outsourced IT services that ensures business continuity and includes provisions for data removal and cooperation during transitions.,Create and document an exit strategy that addresses various exit scenarios and includes clauses on data handling and provider cooperation.,N/A,N/A,No,Not Started,,,
IT_Outsourcing_20250527183423_4a84b4a4-11a8-4180-9ce5-44eaab66b708,Usage of Cloud Computing Services,1,Usage of Cloud Computing Services,"- There are several cloud deployment and service models that have emerged over time. These are generally based on the extent of technology stack that is proposed to be adopted by the consuming entity. Each of these models come with corresponding service, business benefit and risk profiles. - In addition to the Outsourcing of IT Services controls prescribed in these Directions, REs shall adopt the following requirements for storage, computing and movement of data in cloud environments: - 1. While considering adoption of cloud solution, it is imperative to analyse the business strategy and goals adopted to the current IT applications footprint and associated costs. Cloud adoption ranges from moving only non-business critical workloads to the cloud to moving critical business applications such as SaaS adoption and the several combinations in-between, which should be based on a business technology risk assessment. - 2. In engaging cloud services, REs shall ensure, inter alia, that the Outsourcing of IT Services policy addresses the entire lifecycle of data, i.e., covering the entire span of time from generation of the data, its entry into the cloud, till the data is permanently erased/deleted. The REs shall ensure that the procedures specified are consistent with business needs and legal and regulatory requirements. - 3. In adoption of cloud services, REs shall take into account the cloud service specific factors, viz., multi-tenancy, multi-location storing/processing of data, etc., and attendant risks, while establishing appropriate risk management framework. Cloud security is a shared responsibility between the RE and the Cloud Service Provider.",Regulated entities must evaluate business strategies when adopting cloud solutions and ensure comprehensive data lifecycle management while accounting for specific cloud service risks.,"Conduct a business technology risk assessment before implementing any cloud services, ensuring data lifecycle policies align with legal and regulatory requirements.",N/A,N/A,No,Not Started,,,
